{
  "schema_version": "4.0.0-package-index-smoke",
  "generated_at": "pending-human-upload",
  "status": "pending_upload",
  "policy": "This report template does not prove package-index availability. Replace it with examples/adoption/package-index-smoke.json only after a named human upload and a successful public-index install smoke.",
  "index": "pypi",
  "index_url": "https://pypi.org/simple/",
  "extra_index_url": "",
  "package": "software-grimoire",
  "version": "3.0.0",
  "human_upload": {
    "required": true,
    "uploader": "",
    "uploaded_at": "",
    "package_url": "https://pypi.org/project/software-grimoire/"
  },
  "steps": [
    {
      "name": "human package-index upload",
      "passed": false,
      "stdout": "",
      "stderr": "",
      "remediation": "A named maintainer must upload to TestPyPI/PyPI, then run scripts/check_package_index.py without --dry-run."
    }
  ],
  "passed": false
}
